<?xml version="1.0" encoding="UTF-8"?>
<list xmlns:xsi="http://www.w3.org/2001/XMLSchema-instance" xsi:noNamespaceSchemaLocation="../../xsd/items.xsd">
	<item id="20800" type="EtcItem" name="Red Opera Agathion 7-Day Pack - Spear of Flames">
		<!-- Wrapped pack containing a Red Opera Agathion (7 day). Cannot be exchanged, dropped, or sold. Can be stored in a private warehouse. -->
		<set name="icon" val="BranchSys.icon.br_four_leaf_clover_box_i00" />
		<set name="default_action" val="PEEL" />
		<set name="immediate_effect" val="true" />
		<set name="material" val="PAPER" />
		<set name="weight" val="100" />
		<set name="is_tradable" val="false" />
		<set name="is_dropable" val="false" />
		<set name="is_sellable" val="false" />
		<set name="is_depositable" val="false" />
		<set name="is_stackable" val="true" />
		<set name="is_premium" val="true" />
		<set name="is_freightable" val="true" />
		<set name="handler" val="ExtractableItems" />
		<set name="capsuled_items" val="20778,1,1,100" />
	</item>
	<item id="20801" type="EtcItem" name="Opera Agathion Pack">
		<!-- Wrapped pack containing an Opera Agathion. Cannot be exchanged, dropped, or sold. Can be stored in a private warehouse. -->
		<set name="icon" val="BranchSys.icon.br_four_leaf_clover_box_i00" />
		<set name="default_action" val="PEEL" />
		<set name="immediate_effect" val="true" />
		<set name="material" val="PAPER" />
		<set name="weight" val="100" />
		<set name="is_tradable" val="false" />
		<set name="is_dropable" val="false" />
		<set name="is_sellable" val="false" />
		<set name="is_depositable" val="false" />
		<set name="is_stackable" val="true" />
		<set name="is_premium" val="true" />
		<set name="is_freightable" val="true" />
		<set name="handler" val="ExtractableItems" />
		<set name="capsuled_items" val="20779,1,1,100" />
	</item>
	<item id="20802" type="EtcItem" name="Opera Agathion 30-Day Pack - Sword of Life">
		<!-- Wrapped pack containing an Opera Agathion. Cannot be exchanged, dropped, or sold. Can be stored in a private warehouse. -->
		<set name="icon" val="BranchSys.icon.br_four_leaf_clover_box_i00" />
		<set name="default_action" val="PEEL" />
		<set name="immediate_effect" val="true" />
		<set name="material" val="PAPER" />
		<set name="weight" val="100" />
		<set name="is_tradable" val="false" />
		<set name="is_dropable" val="false" />
		<set name="is_sellable" val="false" />
		<set name="is_depositable" val="false" />
		<set name="is_stackable" val="true" />
		<set name="is_premium" val="true" />
		<set name="is_freightable" val="true" />
		<set name="handler" val="ExtractableItems" />
		<set name="capsuled_items" val="20780,1,1,100" />
	</item>
	<item id="20803" type="EtcItem" name="Miss Chipao Agathion 7-Day Pack - Decrease Weight">
		<!-- Wrapped pack containing Miss Chipao Agathion (7 day). Cannot be exchanged, dropped, or sold. Can be stored in a private warehouse. -->
		<set name="icon" val="BranchSys.icon.br_four_leaf_clover_box_i00" />
		<set name="default_action" val="PEEL" />
		<set name="immediate_effect" val="true" />
		<set name="material" val="PAPER" />
		<set name="weight" val="100" />
		<set name="is_tradable" val="false" />
		<set name="is_dropable" val="false" />
		<set name="is_sellable" val="false" />
		<set name="is_depositable" val="false" />
		<set name="is_stackable" val="true" />
		<set name="is_premium" val="true" />
		<set name="is_freightable" val="true" />
		<set name="handler" val="ExtractableItems" />
		<set name="capsuled_items" val="20781,1,1,100" />
	</item>
	<item id="20804" type="EtcItem" name="Nepal Snow Agathion Pack">
		<!-- Wrapped pack containing a Nepal Snow Agathion. Cannot be exchanged, dropped, or sold. Can be stored in a private warehouse. -->
		<set name="icon" val="BranchSys.icon.br_four_leaf_clover_box_i00" />
		<set name="default_action" val="PEEL" />
		<set name="immediate_effect" val="true" />
		<set name="material" val="PAPER" />
		<set name="weight" val="100" />
		<set name="is_tradable" val="false" />
		<set name="is_dropable" val="false" />
		<set name="is_sellable" val="false" />
		<set name="is_depositable" val="false" />
		<set name="is_stackable" val="true" />
		<set name="is_premium" val="true" />
		<set name="is_freightable" val="true" />
		<set name="handler" val="ExtractableItems" />
		<set name="capsuled_items" val="20782,1,1,100" />
	</item>
	<item id="20805" type="EtcItem" name="Round Ball Snow Agathion Pack">
		<!-- Wrapped pack containing a Round Ball Snow Agathion. Cannot be exchanged, dropped, or sold. Can be stored in a private warehouse. -->
		<set name="icon" val="BranchSys.icon.br_four_leaf_clover_box_i00" />
		<set name="default_action" val="PEEL" />
		<set name="immediate_effect" val="true" />
		<set name="material" val="PAPER" />
		<set name="weight" val="100" />
		<set name="is_tradable" val="false" />
		<set name="is_dropable" val="false" />
		<set name="is_sellable" val="false" />
		<set name="is_depositable" val="false" />
		<set name="is_stackable" val="true" />
		<set name="is_premium" val="true" />
		<set name="is_freightable" val="true" />
		<set name="handler" val="ExtractableItems" />
		<set name="capsuled_items" val="20783,1,1,100" />
	</item>
	<item id="20806" type="EtcItem" name="Ladder Snow Agathion Pack">
		<!-- Wrapped pack containing a Ladder Snow Agathion. Cannot be exchanged, dropped, or sold. Can be stored in a private warehouse. -->
		<set name="icon" val="BranchSys.icon.br_four_leaf_clover_box_i00" />
		<set name="default_action" val="PEEL" />
		<set name="immediate_effect" val="true" />
		<set name="material" val="PAPER" />
		<set name="weight" val="100" />
		<set name="is_tradable" val="false" />
		<set name="is_dropable" val="false" />
		<set name="is_sellable" val="false" />
		<set name="is_depositable" val="false" />
		<set name="is_stackable" val="true" />
		<set name="is_premium" val="true" />
		<set name="is_freightable" val="true" />
		<set name="handler" val="ExtractableItems" />
		<set name="capsuled_items" val="20784,1,1,100" />
	</item>
	<item id="20807" type="EtcItem" name="Nepal Snow Agathion 7-Day Pack - Snow's Haste">
		<!-- Wrapped pack containing a Nepal Snow Agathion (7 day). Cannot be exchanged, dropped, or sold. Can be stored in a private warehouse. -->
		<set name="icon" val="BranchSys.icon.br_four_leaf_clover_box_i00" />
		<set name="default_action" val="PEEL" />
		<set name="immediate_effect" val="true" />
		<set name="material" val="PAPER" />
		<set name="weight" val="100" />
		<set name="is_tradable" val="false" />
		<set name="is_dropable" val="false" />
		<set name="is_sellable" val="false" />
		<set name="is_depositable" val="false" />
		<set name="is_stackable" val="true" />
		<set name="is_premium" val="true" />
		<set name="is_freightable" val="true" />
		<set name="handler" val="ExtractableItems" />
		<set name="capsuled_items" val="20785,1,1,100" />
	</item>
	<item id="20808" type="EtcItem" name="Round Ball Snow Agathion 7-Day Pack - Snow's Acumen">
		<!-- Wrapped pack containing a Round Ball Snow Agathion (7 day). Cannot be exchanged, dropped, or sold. Can be stored in a private warehouse. -->
		<set name="icon" val="BranchSys.icon.br_four_leaf_clover_box_i00" />
		<set name="default_action" val="PEEL" />
		<set name="immediate_effect" val="true" />
		<set name="material" val="PAPER" />
		<set name="weight" val="100" />
		<set name="is_tradable" val="false" />
		<set name="is_dropable" val="false" />
		<set name="is_sellable" val="false" />
		<set name="is_depositable" val="false" />
		<set name="is_stackable" val="true" />
		<set name="is_premium" val="true" />
		<set name="is_freightable" val="true" />
		<set name="handler" val="ExtractableItems" />
		<set name="capsuled_items" val="20786,1,1,100" />
	</item>
	<item id="20809" type="EtcItem" name="Ladder Snow Agathion 7-Day Pack - Snow's Wind Walk">
		<!-- Wrapped pack containing a Ladder Snow Agathion (7 day). Cannot be exchanged, dropped, or sold. Can be stored in a private warehouse. -->
		<set name="icon" val="BranchSys.icon.br_four_leaf_clover_box_i00" />
		<set name="default_action" val="PEEL" />
		<set name="immediate_effect" val="true" />
		<set name="material" val="PAPER" />
		<set name="weight" val="100" />
		<set name="is_tradable" val="false" />
		<set name="is_dropable" val="false" />
		<set name="is_sellable" val="false" />
		<set name="is_depositable" val="false" />
		<set name="is_stackable" val="true" />
		<set name="is_premium" val="true" />
		<set name="is_freightable" val="true" />
		<set name="handler" val="ExtractableItems" />
		<set name="capsuled_items" val="20787,1,1,100" />
	</item>
	<item id="20810" type="EtcItem" name="Flame Box Pack">
		<!-- Wrapped pack containing a Flame Box. Cannot be exchanged, dropped, or sold. Can be stored in a private warehouse. -->
		<set name="icon" val="BranchSys.icon.br_four_leaf_clover_box_i00" />
		<set name="default_action" val="PEEL" />
		<set name="immediate_effect" val="true" />
		<set name="material" val="PAPER" />
		<set name="weight" val="100" />
		<set name="is_tradable" val="false" />
		<set name="is_dropable" val="false" />
		<set name="is_sellable" val="false" />
		<set name="is_depositable" val="false" />
		<set name="is_stackable" val="true" />
		<set name="is_premium" val="true" />
		<set name="is_freightable" val="true" />
		<set name="handler" val="ExtractableItems" />
		<set name="capsuled_items" val="20788,1,1,100" />
	</item>
	<item id="20811" type="EtcItem" name="Rocket Gun Hat Pack - Continuous Fireworks">
		<!-- Wrapped pack containing a Rocket Gun Hat. Cannot be exchanged, dropped, or sold. Can be stored in a private warehouse. -->
		<set name="icon" val="BranchSys.icon.br_four_leaf_clover_box_i00" />
		<set name="default_action" val="PEEL" />
		<set name="immediate_effect" val="true" />
		<set name="material" val="PAPER" />
		<set name="weight" val="100" />
		<set name="is_tradable" val="false" />
		<set name="is_dropable" val="false" />